{
  "schema": "quiet-trace/status/v1",
  "records": 12,
  "generation": 7,
  "setup_active": true,
  "calibration_state": "uncalibrated",
  "clock_quality": "monotonic_only",
  "fixture_mode": true,
  "counters": {
    "clipping_samples": 3,
    "framing_error_samples": 1,
    "acquisition_overruns": 2,
    "dropped_intervals": 4,
    "clock_uncertain_intervals": 5,
    "valid_samples": 900,
    "dropped_samples": 30
  }
}
